date,message,channelusername,url,channeltitle,views,forwards,postauthor,"fwdfrom.from_name"
"Mar 20, 2026 @ 19:50:57.000","🇪🇹 — The Amhara-led FANO rebels launched a major offensive in the Gondar area of the Amhara region of Ethiopia.

More than 650 Ethiopian soldiers were killed, and many more were wounded or captured by the rebels.

The mayor of the town of Nefas-Mewcha was also captured by the rebels.",tabzlive,"t.me/tabzlive/75694","Tabz - Alternative Media","7,038",36,"Rayden Skahyv","-"
"Mar 19, 2026 @ 21:16:34.000","#ችሎት 

"" ከአማራ ፋኖ ኃይሎች ጋር በመሆን ከፍተኛ የአማራ ክልል መንግስት ባለስልጣናት ለመግደልና የፌዴራል መንግሥትን ስልጣን በኃይል ለመቆጣጠር አሲረዋል "" በሚል የሽብር ወንጀል ክስ የተመሰረተባቸው ሲሳይ አውግቸው (ዶ/ር) በስር ፍርድ ቤት ተፈቅዶላቸው የነበረው የዋስትና መብት በፌዴራል ጠቅላይ ፍርድ ቤት ውድቅ ተደረገ።

የፌዴራል ከፍተኛ ፍርድ ቤት የካቲት 16 ቀን 2018 ዓ.ም. የ100 ሺህ ብር የዋስትና መብት ፈቅዶላቸው ፤ ከዛም ከእስር ቤት እየወጡ እያለ በር ላይ ድጋሚ መያዛቸው ይታወሳል።

ትናንት መጋቢት 9 ቀን 2018 ዓ.ም. በዋለው ችሎት ጠቅላይ ፍርድ ቤቱ የስር ፍርድ ቤትን ውሳኔ በመሻር የዶ/ር ሲሳይን የዋስትና ጥያቄ ውድቅ ማድረጉን የተከሳሹ ጠበቃ አቶ ሰለሞን ገዛኸኝ ለሪፖርተር ጋዜጣ ገልጸዋል።

መጋቢት 10 ቀን 2018 ዓ/ም

@tikvahethiopia",tikvahethiopia,"t.me/tikvahethiopia/104167","TIKVAH-ETHIOPIA","256,438",30,"-","-"
"Mar 19, 2026 @ 20:07:58.000","🇸🇩🇪🇹⚡️ — The Sudanese army shot down an Ethiopian Bayraktar Akıncı drone that operated above the Northern Kordofan region of Sudan.

➡️ Ethiopia is accused of supporting the RSF rebels and hosting bases on its territory as they have close ties with the UAE, which is the RSF's main backer.

📝Turkish-made drones were supplied to Ethiopia during the Tigray War (2020–2022) to fight off the TPLF rebels; Turkey is, however, not aligned with Ethiopia or the UAE-backed RSF.",tabzlive,"t.me/tabzlive/75484","Tabz - Alternative Media","6,283",31,"Rayden Skahyv","-"
"Mar 19, 2026 @ 17:22:45.000","#Tigray 

የትግራይ ቴሌቪዥን የዜና ክፍል ዳይሬክተር ዮውሃንስ ብርሃነ እና አክቲቪስት ሰናይት መብርሃቱ  በቁጥጥር ስር መዋላቸውን ቲክቫህ ኢትዮጵያ አረጋግጧል።

በትግራይ ቴሌቪዥን የዜና ክፍል ዳይሬክተር ጋዜጠኛ ዮውሃንስ ብርሃነ ትላንት ከሰዓት በኋላ ሲቪል የለበሱ ሰዎች ከአንድ ምግብ ቤት አውጥተው ወስደውታል ሲሉ የቲክቫህ ኢትዮጵያ የመቐለ ቤተሰብ ምንጮች ገልጸዋል።

ምንጮቹ ጋዜጠኛው የት ፓሊስ ጣብያ እንደታሰረ አስመልክተው ያሉት ነገር የለም።

በሌላ በኩል፤ የህወሓት ቀንደኛ ደጋፊ የሆነችው አክቲቪስት ሰናይት መብራህቱ ከሌሎች 4 ተጠርጣሪዎች ጋር በቁጥጥር ስር ውላ ፍርድ ቤት ቀርባለች።

ሰናይትና አብሯዋት የተጠሩጠሩ ግለሰቦች ከመሬት ሽያጭ የተያያዘ የ16 ሚሊዮን ብር የማጭበርበር ክስ ቀርቦላቸዋል።

ተጠርጣሪዎች በህግ ቁጥጥር ካልዋሉ ሌሎች ግብረ አበሮቻቸው የወንጀል ድርጊቱ መፈፀማቸው ጠቅሶ ፓሊስ የ14 ቀናት ተጨማሪ የምርመራ ጊዜ ጠይቋል።

በመቐለ የሓድነት ክፍለ ከተማ ፍርድ ቤት ፓሊስ ያቀረበው ተጨማሪ የ14 ቀናት የምርመራ ቀን ቀጠሮ ተቀብሏል።

ቲክቫህ ኢትዮጵያ
መቐለ
መጋቢት 10 ቀን 2018 ዓ/ም

@tikvahethiopia  ",tikvahethiopia,"t.me/tikvahethiopia/104155","TIKVAH-ETHIOPIA","283,825",55,"-","-"
"Mar 19, 2026 @ 15:24:43.000","https://www.africanews.com/2026/03/19/un-mine-action-chiefs-for-ethiopia-and-sudan-call-for-more-funding/",JoCoIntegrityIntercepts,"t.me/JoCoIntegrityIntercepts/55436","JoCo Integrity Intercept, Eyes on the Truth",14,1,"-","-"
"Mar 19, 2026 @ 08:47:04.000","Ethiopian Renaissance Dam Can Be Seen as Symbol of Energy Sovereignty: Ethiopian Electric Power

The dam will help reduce the risk of power price increases and supply shortages, particularly during periods of political tension and conflict, Moges Mekonnen, the organization’s communications director, told Sputnik Africa, pointing to the current energy challenges linked to tensions in the Middle East.

The dam will also reduce Ethiopia’s dependence on oil and ease pressure on foreign exchange reserves, he emphasized.

👉 Western countries often promote systems that create market dependence, Mekonnen argued. According to him, these systems pressure developing nations to purchase energy—directly or indirectly—from Western countries or their allies. In this context, he described the Renaissance Dam as a turning point that could break this cycle of dependence.

Western-aligned institutions such as the International Monetary Fund and the World Bank are not willing to let Africa build huge projects, Mekonnen stated. These institutions impose political and economic conditions that influence how countries develop and utilize their natural resources, often limiting their autonomy, he noted.

☝️ In contrast, he highlighted Ethiopia’s approach as an example of self-reliance. The country mobilized its internal resources and population to construct the Grand Ethiopian Renaissance Dam, demonstrating what he described as true energy sovereignty.

""Since it is considered a great psychological and economic freedom that I can determine my own destiny, it is a practical demonstration of the principle that African problems are solved by African solutions.""

Countries that are dependent on foreign powers inevitably become the beneficiaries of foreign powers whenever geopolitical crises and tensions arise, Mekonnen concluded.

Subscribe to @sputnik_africa

🔸 Sputnik Africa | X 🔸","-","-","Sputnik Africa | Chat","3,932",14,"-","-"
"Mar 19, 2026 @ 08:47:01.000","Ethiopian Renaissance Dam Can Be Seen as Symbol of Energy Sovereignty: Ethiopian Electric Power

The dam will help reduce the risk of power price increases and supply shortages, particularly during periods of political tension and conflict, Moges Mekonnen, the organization’s communications director, told Sputnik Africa, pointing to the current energy challenges linked to tensions in the Middle East.

The dam will also reduce Ethiopia’s dependence on oil and ease pressure on foreign exchange reserves, he emphasized.

👉 Western countries often promote systems that create market dependence, Mekonnen argued. According to him, these systems pressure developing nations to purchase energy—directly or indirectly—from Western countries or their allies. In this context, he described the Renaissance Dam as a turning point that could break this cycle of dependence.

Western-aligned institutions such as the International Monetary Fund and the World Bank are not willing to let Africa build huge projects, Mekonnen stated. These institutions impose political and economic conditions that influence how countries develop and utilize their natural resources, often limiting their autonomy, he noted.

☝️ In contrast, he highlighted Ethiopia’s approach as an example of self-reliance. The country mobilized its internal resources and population to construct the Grand Ethiopian Renaissance Dam, demonstrating what he described as true energy sovereignty.

""Since it is considered a great psychological and economic freedom that I can determine my own destiny, it is a practical demonstration of the principle that African problems are solved by African solutions.""

Countries that are dependent on foreign powers inevitably become the beneficiaries of foreign powers whenever geopolitical crises and tensions arise, Mekonnen concluded.

Subscribe to @sputnik_africa

🔸 Sputnik Africa | X 🔸","sputnik_africa","t.me/sputnik_africa/62252","Sputnik Africa","1,565",9,"-","-"
"Mar 19, 2026 @ 00:03:09.000","Done. 
Verbiage I used...

I am writing to bring awareness and request diplomatic action concerning Israeli's civil defense authorities sealing of the Church of the Holy Sepulchre — along with the Western Wall and the Temple Mount — on February 28, following joint U.S.-Israeli strikes on Iran and the subsequent wave of Iranian missile and drone retaliation. Fragments from intercepted missiles have fallen in the vicinity of Jerusalem’s Old City. The closure is framed as a precaution against mass gatherings during a period of acute military threat. 

For the Greek Orthodox, Armenian Apostolic, Roman Catholic, Coptic, Syriac, and Ethiopian Orthodox communities whose liturgical lives center on the Holy Sepulchre, there is no substitute building. There is only that church. And for the global Orthodox world connected to it — in Greece, Russia, Serbia, Romania, Bulgaria, and the millions-strong diaspora in America and Australia — the disruption of the Holy Fire ceremony would be without modern precedent.

Since 1988, the flame has departed Jerusalem for Athens, Sofia, Belgrade, and Bucharest every single year — through wars, political crises, and a global pandemic. In 2020 and 2021, when COVID-19 made large gatherings impossible, a minimal delegation still entered the church, the Patriarch still knelt before the tomb, and the flame still flew. This year, for the first time, even that may not happen — not because the church is physically inaccessible, but because the keys are in someone else’s hands.

Request
The U.S. Ambassador to Israel should formally request that a clergy-only Holy Fire ceremony be permitted on Holy Saturday, April 11, under whatever security conditions Israeli authorities require. The COVID pandemic proved this is workable — the Patriarch entered, the flame was lit, the lamps flew to Athens. That precedent exists and it should be invoked immediately, through direct diplomatic channels, before Holy Week begins on March 29.

Additionally, it would carry significant weight,Mr President, for you, as well as the White House Faith Office, to speak publicly expressing concern about Christian access to Easter services in Jerusalem — signaling to the world’s Orthodox Christians, and to Israel, that American religious freedom advocacy is consistently applied.

Thank you for assuring our great nation continues to support religious freedom and all you and your administration have done to  advance freedom in all its forms.",toresaysPlus,"t.me/toresaysPlus/6250982","ToreSays®+","-","-","-","-"
"Mar 18, 2026 @ 23:18:45.000","ethiopia - somalia war. taiwan, japan south korea - north korea",ClashReport,"t.me/ClashReport/486010","Clash Report","-","-","-","-"
"Mar 18, 2026 @ 21:36:12.000","Israel Land of promise. Give it up. Can you need support from Ethiopia you are welcome",presstv,"t.me/presstv/730657","Press TV","-","-","-","-"
"Mar 18, 2026 @ 21:25:11.000","Kim Jong Un personally apologized for receiving only 99.93% of the vote in the parliamentary election, losing 0.07%

He said he is deeply hurt and will try his best next time to secure 100% votes,                                                                                                                                   ...                                                                                                                                                                                                                                                                                                  This army has necks like Ethiopian chickens!!",candlesinthenight,"t.me/candlesinthenight/4712751",MJTruth,"-","-","-","-"
"Mar 18, 2026 @ 20:21:19.000","🚨 BREAKING: The greatest Sec. of State Marco Rubio just slapped a $15,000 FEE on a DOZEN more countries when foreigners try to get an American visa, mostly from Africa

A total of 50 COUNTRIES have the fee — discouraging visa fraud that harms Americans

LFG! Thank you Marco! 🇺🇸

The new countries, added to the list of 38: Cambodia, Ethiopia, Georgia, Grenada, Lesotho, Mauritius, Mongolia, Mozambique, Nicaragua, ​Papua New Guinea, Seychelles, and Tunisia

Rubio previously NAILED IT: ""Our visa system - who you allow to visit your country should reflect the national interest! We said that from the very beginning.""

""The law gives us the RIGHT, and in fact I would argue the OBLIGATION, to remove people like that from our country. And we're going to continue to do it. I mean, it's as simple as that!""",WeTheMediaChat2,"t.me/WeTheMediaChat2/1190161","We The Media - Chat","18,333",153,"-","-"
"Mar 18, 2026 @ 15:45:19.000","Abiy Ahmed is zionist and Israel assets in the horn of Africa. 
He is pure evil 😈 
He murdered his own people.  Almost one million people he killed. 
In the tigre region.",ClashReport,"t.me/ClashReport/484863","Clash Report","-","-","-","-"
"Mar 18, 2026 @ 11:17:46.000","Putin, Abiy Discuss Cooperation After Ethiopia Disaster via Phone

Russian President Vladimir Putin & Ethiopian PM Abiy Ahmed held phone call Monday on Russia-Ethiopia cooperation, nuclear energy plans & a deadly landslide in Ethiopia, reinforcing ties after a September 2025 nuclear agreement.

READ MORE",ClashReport,"t.me/ClashReport/76242","Clash Report","13,390",11,"-","-"
"Mar 17, 2026 @ 22:49:29.000","Female ethiopian jew mossad operative captured in Iran",saviolence1,"t.me/saviolence1/46367","South Africa's violence project",140,1,"-","-"
"Mar 17, 2026 @ 21:48:57.000","The UAE are devious scoundrels, they always provide support and not directly, look at Sudan, Yemen, Ethiopia etc",ClashReport,"t.me/ClashReport/482249","Clash Report","-","-","-","-"
"Mar 17, 2026 @ 15:59:15.000","Ethiopia Urges Fuel Cuts Amid Middle East Shock

PM of Ethiopia Abiy Ahmed Ali warned of rising fuel prices due to Middle East war, urging conservation, boosting subsidies & cracking down on illegal trade to stabilize supply in a fully import-dependent market.

READ MORE",ClashReport,"t.me/ClashReport/76100","Clash Report","8,484",17,"-","-"
"Mar 17, 2026 @ 14:17:16.000","The UAE is supplying military equipment to Ethiopia (armored vehicles, flights, logistics), day and night.

Despite Iran’s attacks against the UAE, it continues to dedicate itself to Africa’s destruction, doing everything it can to turn the region into a bloodbath.",BBToday,"t.me/BBToday/91098","بریده‌ها و براده‌ها",720,7,"-","-"
"Mar 17, 2026 @ 12:05:51.000","How supplying weapon to Ethiopia cause distruction?",ClashReport,"t.me/ClashReport/479992","Clash Report","-","-","-","-"
"Mar 17, 2026 @ 10:58:17.000","UAE please mind your business,  don't support killers in Ethiopia",ClashReport,"t.me/ClashReport/479565","Clash Report","-","-","-","-"
"Mar 17, 2026 @ 10:50:43.000","Turks supplying arms to Syria good, UAE supplying arms to Ethiopia bad",ClashReport,"t.me/ClashReport/479511","Clash Report","-","-","-","-"
"Mar 17, 2026 @ 10:27:07.000","The UAE is supplying military equipment to Ethiopia (armored vehicles, flights, logistics), day and night.

Despite Iran’s attacks against the UAE, it continues to dedicate itself to Africa’s destruction, doing everything it can to turn the region into a bloodbath.",ClashReport,"t.me/ClashReport/76056","Clash Report","10,805",108,"-","-"
"Mar 17, 2026 @ 06:06:43.000","Дайджест событий по Африке (17 марта) от Центра народной дипломатии

♦️Очередной саммит Россия - Африка состоится в Москве в октябре 2026 года

♦️РФ и КЕНИЯ обсудили подготовку третьего саммита Россия - Африка

♦️Глава МИД РФ Сергей Лавров: трудовые мигранты из КЕНИИ работают в РФ только на добровольной основе

♦️Россия перенаправила часть нафты в страны АФРИКИ из-за отказа традиционных партнеров от закупок 

♦️В партнерском Русском доме Центра народной дипломатии в ГВИНЕЕ состоялся кинопоказ, посвященный золотому фонду советского кинематографа

♦️ЭФИОПИЯ призывает к экономии топлива на фоне резкого роста цен из-за войны в Иране

♦️В северной НИГЕРИИ активизировались джихадистские группировки

♦️В Конакри состоялся трехсторонний саммит с участием ГВИНЕИ, СЬЕРРА-ЛЕОНЕ и ЛИБЕРИИ, посвященный пограничной ситуации

♦️Лидер МАДАГАСКАРА назначил нового премьер-министра

♦️РУАНДА и ЭФИОПИЯ заключили соглашение о сотрудничестве в сфере обороны",cndmoscow,"t.me/cndmoscow/3071","Центр народной дипломатии",69,0,"-","-"
"Mar 17, 2026 @ 04:46:04.000","🙅 Not their war: Why Gulf states refuse to fight Iran alongside US & Israel

The countries of the Persian Gulf were making efforts to prevent the war against Iran, and this is likely the reason they refused to participate in the conflict, Iraqi political scientist Abd Al-Malik Al-Huseini tells Sputnik.

Another aspect deterring them from protracted wars is the prosperity and stability the societies of these countries enjoy, he adds, especially given that Iran knows very well how to manage long conflicts.

The intelligence information may have leaned the Gulf states towards avoiding the war, but was not the decisive factor, Yemeni political scientist Abd As-Satar Ash-Shamiri argues.

💬 ""These countries, and the Arab states in general, have learned the lesson of war and seen its consequences in nations that have yet to recover from these conflicts, some of which have been going on for over a decade,"" he adds.

The nations of the Gulf also realized the old ""oil for security"" model of relations with the US is no longer viable, as America now has other priorities, so balanced ties with other powers are needed, the expert concludes.

📌Subscribe to @SputnikInt","-","-","Sputnik International Chat","3,477",22,"-","-"
"Mar 16, 2026 @ 21:48:44.000","Why not in afaan oromoo? We Oromo people are half of Ethiopia. If you need any coordination assistance please contact us.","sputnik_africa","t.me/sputnik_africa/183369","Sputnik Africa","-","-","-","-"
"Mar 16, 2026 @ 21:48:44.000","Why not in afaan oromoo? We Oromo people are half of Ethiopia. If you need any coordination assistance please contact us.","-","-","Sputnik Africa | Chat","-","-","-","-"
"Mar 16, 2026 @ 16:05:31.000","🇷🇺🇪🇹📞 On March 16, President of Russia Vladimir Putin and Prime Minister of Ethiopia Abiy Ahmed had a telephone conversation.

The Leaders discussed current issues of bilateral cooperation in the political, trade-economic and humanitarian spheres, in line with the agreements reached during Abiy Ahmed’s visit to Moscow in September 2025. 

They reaffirmed their mutual commitment to further strengthening friendly Russian-Ethiopian relations and agreed to intensify contacts between the relevant ministries and agencies.

Vladimir Putin also expressed condolences over the natural disaster that struck southern Ethiopia last week – a landslide that caused numerous casualties and destruction.

#RussiaEthiopia",MFARussia,"t.me/MFARussia/28716","Russian MFA 🇷🇺","1,325",5,"-","-"
"Mar 16, 2026 @ 14:27:01.000","🇷🇺🇪🇹 Russian President Vladimir Putin and Ethiopian Prime Minister Abiy Ahmed held a phone call on Monday, the Kremlin press service said.

“The sides discussed current issues of bilateral cooperation in the political, trade, economic, and humanitarian spheres in light of agreements reached during Abiy Ahmed’s visit to Moscow in September 2025,” it said.","tassagency_en","t.me/tassagency_en/77249","-",828,1,"-","-"
"Mar 16, 2026 @ 13:47:39.000","🇷🇺🇪🇹 Vladimir Putin had a telephone conversation with Prime Minister of the Federal Democratic Republic of Ethiopia Abiy Ahmed

🔹The leaders discussed a number of current issues pertaining to bilateral cooperation in the political, trade and economic, and humanitarian spheres in line with the agreements reached following Abiy Ahmed's visit to Moscow in September 2025. Both sides reaffirmed their commitment to further strengthening the friendly Russia-Ethiopia relations and intensifying contacts between relevant ministries and agencies.

🔹Vladimir Putin expressed his condolences over the cataclysmic landslides that hit southern Ethiopia last week, resulting in numerous casualties and heavy damage.","news_kremlin_eng","t.me/news_kremlin_eng/7159","Kremlin. News",732,5,"-","-"
"Mar 16, 2026 @ 04:33:56.000","Survivor pulled from mud after 3 days as Ethiopia landslide death toll hits 107
https://www.arabtimesonline.com/news/survivor-pulled-from-mud-after-3-days-as-ethiopia-landslide-death-toll-hits-107/",AzazelNews,"t.me/AzazelNews/971810","Azazel News",134,1,"-","-"
"Mar 16, 2026 @ 03:45:12.000","You mentioned UAE.... 

Egypt, Ethiopia, Iran, and the United Arab Emirates joined the BRICS bloc. That makes the UAE a friend of Iran China and Russia. They should ask their own friends...but MBZ is a back stabbing piece of shit and won't ask 😁",AussieCossack,"t.me/AussieCossack/1443712","🇦🇺AussieCossack🇷🇺","-","-","-","-"
"Mar 16, 2026 @ 02:18:20.000","https://youtu.be/2c3DfT3YrOk",MurderTheMediaComments,"t.me/MurderTheMediaComments/257951","MurderTheMedia chat","-","-","-","-"
"Mar 15, 2026 @ 16:55:24.000","#Tigray

ብዛታቸው 30 የሆኑ የትግራይ ቴሌቪዥን ጋዜጠኞ ስምና ፊርማቸውን አያይዘው መጋቢት 5/2018 ዓ.ም ለጊዚያዊ አስተዳደሩ ፕሬዜዳንት ሌ/ጄነራል ታደሰ ወረደ በፃፉት ደብዳቤ፥ የየካቲት ወር ደመወዛቸው ካልተከፈላቸው ስራ እንደሚያቆሙ አሳውቀዋል።

ወርሃዊ ደመወዛቸው ስላልተከፈላቸው የክልሉ ጤና ባለሙያዎችም ደመወዝ ባለማግኘታቸው ለተለያዩ ኢኮኖሚያዊና ማህበራዊ ችግሮች መጋለጣቸውን በማመልከት ደመወዛቸው በአስቸኳይ እንዲከፈላቸው በማኅበራቸው በኩል ጠይቀዋል።

የትግራይ መምህራን ማህበርም በበኩሉ የየካቲት ወር ደመወዝ በአስቸኳይ እንዲከፈል ጠይቋል። 

በትግራይ 137 ሺህ የሚደርሱ የመንግስት ሰራተኞች አሉ።

ቲህቫህ ኢትዮጵያ
መቐለ
መጋቢት 6 ቀን 2018 ዓ/ም

@tikvahethiopia  ",tikvahethiopia,"t.me/tikvahethiopia/104077","TIKVAH-ETHIOPIA","317,345",45,"-","-"
"Mar 14, 2026 @ 15:08:46.000","As to the Mizrahi Jews, of course there is now a caste system.  The Ashkenazi Jews (who are not Semitic, but Khazarian) are the top caste.  Sephardic next, then Mizrahi, and they don't even accept Ethiopian Jews because ZioNazism is an extremely racist ideology.",presstv,"t.me/presstv/720023","Press TV","-","-","-","-"
